{
  "ticker": "SBER",
  "requested_action": "BUY",
  "approved_action": "BUY",
  "approved": true,
  "position_context": {
    "current_lots": 0,
    "cash_available": 50000.0
  },
  "risk_checks": {
    "cash_ok": true,
    "position_limit_ok": true,
    "daily_loss_limit_ok": true,
    "cooldown_ok": true,
    "min_edge_ok": true
  },
  "order_intent": {
    "side": "BUY",
    "quantity_lots": 2,
    "order_type": "LIMIT",
    "limit_price": 301.5
  },
  "blocked_reason": null
}
